{
 "$schema": "https://json-schema.org/draft/2020-12/schema",
 "$id": "https://zamakan.agency/schemas/story-map/1",
 "title": "Story map: the writer's story idea laid on a structure (written by Claude, built by story_template.py). Only the writer's own words are quoted; everything Claude adds is a question.",
 "type": "object",
 "required": [
  "schema",
  "lang",
  "story",
  "kind",
  "minutes",
  "structure",
  "why_structure",
  "heard",
  "beats"
 ],
 "additionalProperties": false,
 "properties": {
  "schema": {
   "const": "zamakan-story-map/1"
  },
  "lang": {
   "enum": [
    "ar",
    "en"
   ]
  },
  "title": {
   "type": "string",
   "description": "the writer's working title, if they gave one"
  },
  "story": {
   "type": "string",
   "description": "the writer's story exactly as sent (typed or a voice-note transcript), untouched"
  },
  "kind": {
   "enum": [
    "short",
    "feature",
    "documentary"
   ]
  },
  "minutes": {
   "type": "integer",
   "minimum": 1
  },
  "structure": {
   "type": "string",
   "description": "id in references/structures.json"
  },
  "why_structure": {
   "type": "string",
   "description": "one sentence: why this structure fits this story's shape"
  },
  "alt_structure": {
   "type": "object",
   "required": [
    "id",
    "why"
   ],
   "additionalProperties": false,
   "properties": {
    "id": {
     "type": "string"
    },
    "why": {
     "type": "string"
    }
   }
  },
  "heard": {
   "type": "array",
   "minItems": 1,
   "items": {
    "type": "object",
    "required": [
     "element",
     "open_question"
    ],
    "additionalProperties": false,
    "properties": {
     "element": {
      "enum": [
       "hero",
       "want",
       "obstacle",
       "turn",
       "ending",
       "world",
       "tone",
       "theme",
       "other",
       "subject",
       "question",
       "access",
       "approach"
      ]
     },
     "quote": {
      "type": "string",
      "description": "the writer's exact words for this element; leave out when the story doesn't say (that is a gap)"
     },
     "open_question": {
      "type": "string",
      "description": "what is still open, as a question about THIS story"
     }
    }
   }
  },
  "beats": {
   "type": "object",
   "description": "beat id → the writer's fragments that may belong there, and questions about this story",
   "additionalProperties": {
    "type": "object",
    "additionalProperties": false,
    "properties": {
     "fragments": {
      "type": "array",
      "items": {
       "type": "string"
      },
      "description": "exact quotes from the story"
     },
     "questions": {
      "type": "array",
      "items": {
       "type": "string"
      }
     }
    }
   }
  },
  "characters": {
   "type": "array",
   "items": {
    "type": "object",
    "required": [
     "name"
    ],
    "additionalProperties": false,
    "properties": {
     "name": {
      "type": "string",
      "description": "as the writer calls them (\"her uncle\", «عمها»)"
     },
     "quote": {
      "type": "string"
     }
    }
   },
   "description": "people in the story; for a documentary these are real people (subjects)"
  },
  "places": {
   "type": "array",
   "items": {
    "type": "object",
    "required": [
     "place"
    ],
    "additionalProperties": false,
    "properties": {
     "place": {
      "type": "string"
     },
     "quote": {
      "type": "string"
     },
     "cost_note": {
      "type": "string",
      "description": "a question about what it costs to shoot"
     }
    }
   }
  },
  "sections": {
   "type": "object",
   "description": "documentary only: proposal section id (references/doc_proposal.json) → the writer's fragments and questions",
   "additionalProperties": {
    "type": "object",
    "additionalProperties": false,
    "properties": {
     "fragments": {
      "type": "array",
      "items": {
       "type": "string"
      },
      "description": "exact quotes from the story"
     },
     "questions": {
      "type": "array",
      "items": {
       "type": "string"
      }
     }
    }
   }
  }
 }
}
