{"schema": "zamakan-story-map/1", "lang": "ar", "title": "المرساة", "kind": "short", "minutes": 12,
 "story": "بنت عمرها ١٧ في صور، أبوها صياد مات، وتبغى تطلع البحر بقاربه. عمها يرفض. في النهاية تطلع لحالها. أبغاه فيلم قصير ١٢ دقيقة.",
 "structure": "short-one-moment", "why_structure": "قصتك انعطافة واحدة (تطلع البحر)، لا رحلة طويلة؛ فيلم قصير يقوم على لحظة واحدة.",
 "alt_structure": {"id": "three-act", "why": "إن أردت أن يأخذ صراعها مع عمها مراحل متصاعدة."},
 "heard": [
  {"element": "hero", "quote": "بنت عمرها ١٧ في صور", "open_question": "ماذا تفعل في الصفحة الأولى فيكشف لنا من هي؟"},
  {"element": "want", "quote": "تبغى تطلع البحر بقاربه", "open_question": "لماذا الآن؟ وماذا يحدث لو لم تخرج؟"},
  {"element": "obstacle", "quote": "عمها يرفض", "open_question": "ما الذي يخاف العم أن يخسره؟"},
  {"element": "turn", "open_question": "ما الذي يجعل خروجها ممكناً أو ضرورياً؟"},
  {"element": "ending", "quote": "في النهاية تطلع لحالها", "open_question": "ماذا تترك خلفها، أو تدفع، لتصل إلى هناك؟"}],
 "beats": {
  "hook": {"fragments": ["أبوها صياد مات"], "questions": ["ما الصورة الأولى التي تقول إن أباها رحل دون أن يقولها أحد؟"]},
  "pressure": {"fragments": ["عمها يرفض"], "questions": ["هل يرفض العم مرة واحدة، أم يزداد رفضه صعوبة؟", "ماذا تجرّب هي بين رفض وآخر؟"]},
  "turn": {"questions": ["من يتخذ القرار هنا: هي أم غيرها؟", "ما الذي تخسره بهذا القرار؟"]},
  "after": {"fragments": ["في النهاية تطلع لحالها"], "questions": ["ما الصورة التي تبقى بعد أن تبحر؟"]}},
 "characters": [{"name": "البنت", "quote": "بنت عمرها ١٧"}, {"name": "العم", "quote": "عمها يرفض"}, {"name": "الأب (رحل)", "quote": "أبوها صياد مات"}],
 "places": [{"place": "صور", "quote": "في صور"}, {"place": "البحر", "quote": "تطلع البحر", "cost_note": "التصوير في البحر مكلف: كم مشهداً يحتاج البحر فعلاً؟"}]}
