{
 "schema": "zamakan-story-map/1",
 "lang": "ar",
 "story": "أبغى أسوي وثائقي عن آخر صانعي السفن الخشبية في صور. في ورشة على الخور فيه رجل اسمه سالم، عمره تقريباً سبعين، يبني الغنجة بيده من غير رسم ولا مخطط، كل شي في راسه. ولده يشتغل في شركة نفط في مسقط وما يبغى يكمل الصنعة. سالم قاعد يبني آخر سفينة طلبها منه تاجر من قطر، ويقول هذي بتكون الأخيرة.\nسؤالي: إذا مات سالم، وين تروح الصنعة؟ هل تنكتب في كتاب ولا تموت معه؟\nسالم وافق إني أصوره، بس ولده ما رد علي للحين. عندي صور قديمة لجد سالم من أرشيف عائلي، وأبغى أصور من بداية السفينة لين تنزل البحر، تقريباً سنة.\nما أبغى تعليق صوتي، أبغى نسمع صوت المطرقة والخشب والبحر، وسالم يتكلم وهو يشتغل.",
 "kind": "documentary",
 "minutes": 52,
 "structure": "doc-character",
 "why_structure": "القصة تدور حول رجل واحد وسفينة لها بداية ونهاية، فبناء الشخصية في ثلاثة فصول يتبع السفينة من أول لوح إلى نزولها البحر.",
 "alt_structure": {
  "id": "doc-observational",
  "why": "إذا قررت أن تترك المشاهد تتكشف دون مقابلات، فالرصدي يناسب رغبتك في عدم وجود تعليق."
 },
 "heard": [
  {
   "element": "subject",
   "quote": "رجل اسمه سالم، عمره تقريباً سبعين، يبني الغنجة بيده من غير رسم ولا مخطط",
   "open_question": "ماذا يفعل سالم في يومه حين لا يبني؟"
  },
  {
   "element": "question",
   "quote": "إذا مات سالم، وين تروح الصنعة؟",
   "open_question": "هل سيجيب الفيلم عن هذا السؤال، أم يتركه للمشاهد؟"
  },
  {
   "element": "access",
   "quote": "سالم وافق إني أصوره، بس ولده ما رد علي للحين",
   "open_question": "ماذا يصبح الفيلم إذا رفض الابن الظهور؟"
  },
  {
   "element": "approach",
   "quote": "ما أبغى تعليق صوتي",
   "open_question": "كيف سيعرف المشاهد أن هذه السفينة الأخيرة دون تعليق؟"
  },
  {
   "element": "world",
   "quote": "ورشة على الخور",
   "open_question": "من غير سالم يعمل في الورشة أو يمر بها؟"
  },
  {
   "element": "ending",
   "open_question": "ماذا لو لم تُكمل السفينة خلال السنة؟"
  }
 ],
 "beats": {
  "world": {
   "fragments": [
    "يبني الغنجة بيده من غير رسم ولا مخطط، كل شي في راسه"
   ],
   "questions": [
    "ما أول صورة تعرّفنا أن كل شيء في رأسه؟"
   ]
  },
  "stakes": {
   "fragments": [
    "ولده يشتغل في شركة نفط في مسقط وما يبغى يكمل الصنعة",
    "يقول هذي بتكون الأخيرة"
   ]
  },
  "outcome": {
   "fragments": [
    "لين تنزل البحر"
   ],
   "questions": [
    "هل نزول السفينة هو النهاية، أم ما يحدث بعده؟"
   ]
  }
 },
 "sections": {
  "question": {
   "fragments": [
    "هل تنكتب في كتاب ولا تموت معه؟"
   ]
  },
  "access": {
   "fragments": [
    "سالم وافق إني أصوره"
   ],
   "questions": [
    "هل وافق التاجر القطري على الظهور؟"
   ]
  },
  "archive": {
   "fragments": [
    "صور قديمة لجد سالم من أرشيف عائلي"
   ],
   "questions": [
    "من يملك حقوق هذه الصور، وهل كتبت الموافقة؟"
   ]
  },
  "sound": {
   "fragments": [
    "نسمع صوت المطرقة والخشب والبحر"
   ]
  },
  "schedule": {
   "fragments": [
    "تقريباً سنة"
   ]
  }
 },
 "characters": [
  {
   "name": "سالم",
   "quote": "رجل اسمه سالم"
  },
  {
   "name": "ولده",
   "quote": "ولده يشتغل في شركة نفط"
  },
  {
   "name": "التاجر",
   "quote": "تاجر من قطر"
  }
 ],
 "places": [
  {
   "place": "الورشة على الخور",
   "quote": "ورشة على الخور",
   "cost_note": "كم يوم تصوير في السنة تحتاج، وأين تبيت الفريق في صور؟"
  }
 ]
}